881,Port And Starboard,"ordinary drink, ordinary drink","Pour carefully into a pousse-cafe glass, so that creme de menthe floats on grenadine. Serve without mixing.",http://www.thecocktaildb.com/images/media/drink/wxvupx1441553911.jpg,,grenadine,1 tblsp,green creme de menthe,1/2 oz,,,,,,,,,,,,,,,,,,,,
882,Port Wine Cocktail,"ordinary drink, ordinary drink","Stir ingredients with ice, strain into a cocktail glass, and serve.",http://www.thecocktaildb.com/images/media/drink/qruprq1441553976.jpg,spicy,port,2 1/2 oz,brandy,1/2 tsp,,,,,,,,,,,,,,,,,,,,
883,Port Wine Flip,"ordinary drink, ordinary drink",Shake all ingredients (except nutmeg) with ice and strain into a whiskey sour glass. Sprinkle nutmeg on top and serve.,http://www.thecocktaildb.com/images/media/drink/vrprxu1441553844.jpg,,port,1 1/2 oz,light cream,2 tsp,powdered sugar,1 tsp,egg,1 whole,nutmeg,,,,,,,,,,,,,,,
884,Port's North Fogcutter Cup,,,,,luxardo aperitivo,1 oz,luxardo apricot liqueur,.5 oz,napa valley moscato late harvest (mondavi moscato d'oro),1 oz,dry amontillado sherry,1 oz,lemon juice,.75 oz,junipero gin,.5 oz,house-made orgeat,.5 oz,cinnamon tincture,15 microdrops,,,,,,,,
885,Porto flip,"ordinary drink, ordinary drink","Shake ingredients together in a mixer with ice. Strain into glass, garnish and serve.",http://www.thecocktaildb.com/images/media/drink/64x5j41504351518.jpg,sour,brandy,3 parts,port,9 parts,egg yolk,2 parts,,,,,,,,,,,,,,,,,,
886,Potrero Hill,,,,,junipero gin,1 oz,white peach & orange chamomile infused sweet vermouth,.5 oz,cinnamon wineshine brandy,.5 oz,simple syrup,1 dash,grapefruit juice,.5 oz,lemon juice,.5 oz,bundaberg ginger beer,4 oz,,,,,,,,,,
887,Prata Punch,,"For punch, combine Ypioca, Lillet Rose, guava nectar, lime and agave. Top with Rosa Regale sparkling and add sliced strawberries and thin-sliced lime wheels to float as garnish.. . For individual cocktails, muddle 2-3 strawberry slices w/ agave and add Ypioca, guava and Lillet. Add ice and shake to chill/mix. Strain over ice and top with champagne. Garnish with thin-sliced strawberry. Remember, this is an aperitif style so it's meant to be refreshing but not necessarily sweet.",,,brasilizar cachaca prata reserva especial,2 part ypioc,part lillet rose,.5,ar,.5 part guava nec,,.25 part fresh lime juic,part agave,.25,banfi rosa regale sparkling wine,top,,,,,,,,,,,,
888,Prickly Pear Margarita,,Mint salt on the rim. Garnish with mint sprig.,,,chinaco blanco tequila,2 oz,lime juice,1 oz,prickly pear puree,.5 oz,agave,.5 oz,,,,,,,,,,,,,,,,
889,Primo Carnera,,"Shake and strain into a martini glass, spray some absinthe on the glass.",,,luxardo sangue morlacco cherry liqueur,45 ml,luxardo triplum (triple sec),15 ml,luxardo liquore st. antonio,20 ml,,,,,,,,,,,,,,,,,,
890,Prince of Humbugs,,Build in collins glass. Top with soda. Orange peel.,,,hirsch small batch reserve bourbon,2 oz,luxardo bitter,.75 oz,cold blue bottle coffee,.5 oz,luxardo anisette,.25 oz,peychaud's bitters,2 dash,,,,,,,,,,,,,,
891,Profundo,,Pour the liquor ingredients over ice and top with half inch (about one centimeter) layer of lightly whipped cream shaken with Hum Liqueur.,,,hirsch small batch reserve bourbon,1.25 oz,luxardo sangue morlacco cherry liqueur,1.25 oz,chocolate liqueur,.5 oz,heavy cream flavored with hum liqueur,1 oz,,,,,,,,,,,,,,,,
892,Pumpkin & Pecan,,Shake. Double strain. King cube. Orange peel garnish,,,h by hine,2 oz,toasted pecan syrup,.5 oz,lemon juice,.75 oz,cynar,.5 oz,spiced pumpkin butter,1 bsp,cinnamon tincture,2 dash,,,,,,,,,,,,
893,Pumpkin and Spice,,"In a Boston shaker, combine all liquid ingredients except the ginger beer. Shake vigorously for 25 seconds and strain over fresh ice in a rocks glass. Top with the ginger beer and grate the fresh nutmeg over the top.. . *Oatmeal-Infused Karlsson's Gold Vodka:. -- 750 ml Karlsson's Gold Vodka. -- 2 C Raw Oats. . Using a large sauté pan toast the oats for about 10 minutes constantly watching them and making sure they don't burn. Once aromatic and have a touch of color add the oats to a mason jar with the vodka and let infuse for 12-24 hours. Strain and press out all the vodka from the oats. Return the liquid to the bottle and store in a cool dark place.",,,oatmeal-infused karlsson's gold vodka*,1.5 oz,ginger beer,1.5 oz,oloroso sherry,.5 oz,st. elizabeth allspice dram,.25 oz,molasses,.25 oz,pumpkin puree,1 bsp,ure fee brothers black walnut bitters,1 tinc,,,,,,,,,,
894,Pysch Vitamin Light,ordinary drink,Shake with ice.,http://www.thecocktaildb.com/images/media/drink/xsqsxw1441553580.jpg,,orange juice,1 part,apple juice,1 part,pineapple juice,1 part,ice,,,,,,,,,,,,,,,,,
895,Quaker's Cocktail,"ordinary drink, ordinary drink","Shake all ingredients with ice, strain into a cocktail glass, and serve.",http://www.thecocktaildb.com/images/media/drink/yrqppx1478962314.jpg,sour,light rum,3/4 oz,brandy,3/4 oz,lemon,juice of 1/4,raspberry syrup,2 tsp,,,,,,,,,,,,,,,,
896,Quarter Deck Cocktail,"ordinary drink, ordinary drink","Stir all ingredients with ice, strain into a cocktail glass, and serve.",http://www.thecocktaildb.com/images/media/drink/qrwvps1478963017.jpg,cream,light rum,1 1/2,sherry,1/3 oz cream,lime,juice of 1/2,,,,,,,,,,,,,,,,,,
897,Queen Bee,"ordinary drink, ordinary drink","Shake all ingredients with ice, strain into a cocktail glass, and serve.",http://www.thecocktaildb.com/images/media/drink/rvvpxu1478963194.jpg,sweet,coffee brandy,1 oz,lime vodka,1 1/2 oz,sherry,1/2 oz cream,,,,,,,,,,,,,,,,,,
898,Queen Charlotte,"ordinary drink, ordinary drink","Pour red wine and grenadine into a collins glass over ice cubes. Fill with lemon-lime soda, stir, and serve.",http://www.thecocktaildb.com/images/media/drink/vqruyt1478963249.jpg,,red wine,2 oz,grenadine,1 oz,lemon-lime soda,,,,,,,,,,,,,,,,,,,
899,Queen Elizabeth,"ordinary drink, ordinary drink","Stir all ingredients with ice, strain into a cocktail glass, and serve.",http://www.thecocktaildb.com/images/media/drink/vpqspv1478963339.jpg,,dry vermouth,1/2 oz,gin,1 1/2 oz,benedictine,1 1/2 tsp,,,,,,,,,,,,,,,,,,
900,Quentin,"ordinary drink, shot","In a shaker half-filled with ice cubes, combine the rum, Kahlua, and cream. Shake well. Strain into a cocktail glass and garnish with the nutmeg.",http://www.thecocktaildb.com/images/media/drink/spxtqp1478963398.jpg,,dark rum,1 1/2 oz,kahlua,1/2 oz,light cream,1 oz,nutmeg,1/8 tsp grated,,,,,,,,,,,,,,,,
901,Quick F**K,"shot, ordinary drink","In a shot glass add 1/3 Kahlua first. Then 1/3 Miduri, topping it off with a 1/3 bailey's irish cream",http://www.thecocktaildb.com/images/media/drink/wvtwpp1478963454.jpg,,kahlua,1 part,midori melon liqueur,1 part,bailey's irish cream,1 part,,,,,,,,,,,,,,,,,,
902,Quick-sand,"ordinary drink, ordinary drink","Simply add the orange juice, quite a quick pour in order to mix the sambucca with the orange juice. The juice MUST have fruit pulp!",http://www.thecocktaildb.com/images/media/drink/vprxqv1478963533.jpg,,black sambuca,25 ml,orange juice,add 250 ml,,,,,,,,,,,,,,,,,,,,
903,Radice Amara,,"Combine ingredients in mixing glass, and stir with ice to dilution. Strain into a coupe cocktail glass. Garnish with a trimmed carrot ribbon.",,,luxardo bitter bianco,1.5 oz,reisetbauer carrot eau de vie,1 oz,genevieve gin,.75 oz,,,,,,,,,,,,,,,,,,
904,Radioactive Long Island Iced Tea,"ordinary drink, ordinary drink",Pour all ingredients over ice in a very tall glass. Sip cautiously.,http://www.thecocktaildb.com/images/media/drink/rdvqmh1503563512.jpg,,rum,1 oz,vodka,1 oz,tequila,1 oz,gin,1 oz,triple sec,1 oz,chambord raspberry liqueur,1 oz,midori melon liqueur,1 oz,malibu rum,1 oz,,,,,,,,
905,Radler,"ordinary drink, other,unknown","Pour beer into large mug, slowly add the 7-up (or Sprite).",http://www.thecocktaildb.com/images/media/drink/xz8igv1504888995.jpg,,beer,12 oz,7-up,12 oz,,,,,,,,,,,,,,,,,,,,
906,Rail Splitter,cocktail,Mix sugar syrup with lemon juice in a tall glass. Fill up with ginger ale.,http://www.thecocktaildb.com/images/media/drink/stsuqq1441207660.jpg,,sugar syrup,2 tsp,lemon juice,,ginger ale,,,,,,,,,,,,,,,,,,,
907,Raspberry Batida,,"Place all ingredients in a mixing tin, muddle fresh raspberries, add ice and shake until tin is frosty. Strain into a chilled highball glass. Garnish with orange wedge.",,,ypioca brasilizar cachaca prata reserva especial,2 oz,sweetened condensed coconut milk,1 oz,almond milk,1 oz,briottet creme de framboise (raspberry),.5 oz,tempus fugit creme de cacao,.5 oz,handful fresh raspberries,1,rubarb bitters,2 dash,,,,,,,,,,
908,Raspberry Cooler,"other,unknown, shot",Pour the raspberry vodka and soda into a highball glass almost filled with ice cubes. Stir well.,http://www.thecocktaildb.com/images/media/drink/suqyyx1441254346.jpg,,raspberry vodka,2 oz,lemon-lime soda,4 oz,ice,,,,,,,,,,,,,,,,,,,
909,Red Bud Trail,,Pour into shaker over ice and shake well. Serve straight up in a martini glass with an orange twist.,,,no.3 london dry gin,1.5 oz,luxardo sangue morlacco cherry liqueur,.75 oz,dry vermouth,.5 oz,tempus fugit alessio vermouth di torino rosso,.25 oz,angostura bitters,1 dash,,,,,,,,,,,,,,
910,Red Hook,,,,,rye whiskey,2 oz,punt e mes,5 oz,luxardo maraschino liqueur,.5 oz,,,,,,,,,,,,,,,,,,
911,Red Letters,,"Shake with ice, strain and pour into a chilled martini glass.",,,bols genever,.75 oz,luxardo maraschino liqueur,.75 oz,absinthe,.75 oz,lime juice,.75 oz,,,,,,,,,,,,,,,,
912,Red Snapper,"shot, ordinary drink","One shot each, shake n shoot",http://www.thecocktaildb.com/images/media/drink/7p607y1504735343.jpg,,crown royal,1 shot,amaretto,1 shot,cranberry juice,1 shot,,,,,,,,,,,,,,,,,,
913,Redondo Beach,,Blend with ice.,,,chinaco blanco tequila,1.5 oz,f. meyer mirabelle (yellow plum),.25 oz,fino sherry,.5 oz,the genuine curacao liqueur blue,.75 oz,horchata,2 oz,simple syrup (2:1),.5 oz,lime juice,.5 oz,,,,,,,,,,
914,Rhapsody in Red,,"Muddle strawberries in a shaker with agave nectar, add lime juice, hibiscus tea, and Chinaco Blanco. Top with sparkling water.",,,chinaco blanco tequila,1.5 oz,wild hibiscus tea,1 oz,fresh lime juice,.5 oz,agave nectar,.5 oz,strawberries,strawberrie,sparkling water,top,,,,,,,,,,,,
915,Rio De Janeiro Mule,,"Pour ingredients into mug, fill with ice. top with ginger ale. Roll into tin. Roll back into mug. Garnish.",,,ypioca brasilizar cachaca prata classica,1.5 oz,ginger citrus agave blend,1.5 oz,ginger ale,5 oz,aromatic bitters,1 dash,,,,,,,,,,,,,,,,
916,Rita's Song,,"Build in old fashioned glass, stir and serve over large ice cube.",,,nikka whisky taketsuru pure malt 12 yo,2 oz,15 yo sherry,.5 oz,s dr. adam's boker's bitters,2 dash,simple syrup,.25 oz,,,,,,,,,,,,,,,,
917,Ritz Cocktail,,"Add all ingredients except the champagne to a mixing glass and fill with ice. Stir, and strain into a martini glass. Fill with champagne and garnish with a flamed orange peel.",,,cognac,.75 oz,cointreau,.5 oz,luxardo maraschino liqueur,.25 oz,fresh lemon juice,.25 oz,champagne,3 oz,,,,,,,,,,,,,,
918,Roasted Cherry Colada,,"In a blender, combine white rum, Luxardo, coconut milk, lime juice, sugar, bitters, 3 cherries, and 1 cup ice and purée until smooth; pour into a tiki glass and top with black rum. Place halved cherry, cut-side up, on top of cocktail and fill with Everclear before lighting cherry on fire.",,,white rum,2 oz,luxardo sangue morlacco cherry liqueur,1.75 oz,coconut milk,1 oz,fresh lime juice,1 oz,demerara sugar,.5 tsp,miracle mile forbidden barrel aged bitters,10 dash,roasted cherries,3,black rum,1 oz,everclear,1 tsp,,,,,,
919,Root Down,,In a Boston shaker combine all liquid ingredients except the ginger beer with whole hard ice and shake vigorously for 30 seconds. Double strain the cocktail over whole hard ice cubes in a 13 oz. rocks glass and top with the ginger beer. Garnish with the licorice root.,,,karlsson's gold vodka (root-infused),2 oz,cardamaro,.5 oz,fresh lemon juice,.5 oz,grade-a dark maple syrup,.5 oz,fenteman's ginger beer,1.5 oz,whole licorice root,4 inc,,,,,,,,,,,,
920,Rose,"ordinary drink, shot","Shake together in a cocktail shaker, then strain into chilled glass. Garnish and serve.",http://www.thecocktaildb.com/images/media/drink/8kxbvq1504371462.jpg,,dry vermouth,1/2 oz,gin,1 oz,apricot brandy,1/2 oz,lemon juice,1/2 tsp,grenadine,1 tsp,powdered sugar, ,,,,,,,,,,,,
921,Rose Sangria,,"Combine all ingredients in a wine glass, stir to mix. Add ice and enjoy.  . Convert ounces to cups to make a larger pitcher for you and your guests.",,,pink pigeon rum,1.5 oz,fresh lemon juice,.5 oz,honey syrup (1:1 honey & water),.75 oz,pomegranate juice,1 oz,rose wine,3 oz,cinnamon,cinnamo,grated,grate,nutmeg,nutme,grated,grate,cherries,cherrie,strawberries,strawberrie,watermelon,watermelo
922,Rothes Julep,,Pour ingredients into cocktail shaker and shake vigorously with ice. Strain into a rocks glass over crushed ice with a mint sprig garnish.,,,glenrothes vintage reserve,2 oz,syrup,simple,mint leaves,5,,,,,,,,,,,,,,,,,,
923,Rothes Roy,,"Add all the ingredients to a mixing glass and fill with ice. Stir, and strain into a chilled cocktail glass. Garnish with a Luxardo Cherry.",,,glenrothes vintage reserve,2 oz,tempus fugit alessio vermouth di torino rosso,.75 oz,angostura bitters,3 dash,,,,,,,,,,,,,,,,,,
924,Round Pond Aperitif,,"Combine all ingredients except soda in a shaker with ice, shake to combine. Pour into a coupe glass and garnish with a lemon peel.",,,luxardo aperitivo,1.5 oz,round pond blood orange syrup,.5 oz,fresh lemon juice,.5 oz,sparkling wine,1 splash,,,,,,,,,,,,,,,,
925,Royal Bitch,"shot, ordinary drink",Into a shot glass layer the Crown Royal on top of the Frangelico.,http://www.thecocktaildb.com/images/media/drink/qupuyr1441210090.jpg,egg,frangelico,1 part,crown royal,1 part,,,,,,,,,,,,,,,,,,,,
926,Royal Fizz,"ordinary drink, shot",Shake all ingredients (except cola) with ice and strain into a chilled collins glass. Fill with cola and serve.,http://www.thecocktaildb.com/images/media/drink/wrh44j1504390609.jpg,,gin,1 oz,sweet and sour,2 oz,egg,1 whole,coca-cola,,,,,,,,,,,,,,,,,
927,Royal Flush,"shot, ordinary drink",Pour all the ingredients into tumbler over ice. Strain into glass.,http://www.thecocktaildb.com/images/media/drink/7rnm8u1504888527.jpg,,crown royal,1 1/2 oz,peach schnapps,1 oz,chambord raspberry liqueur,1/2 oz,cranberry juice,1 oz,,,,,,,,,,,,,,,,
928,Royal Gin Fizz,"ordinary drink, cocktail","Shake all ingredients (except carbonated water) with ice and strain into a highball glass over two ice cubes. Fill with carbonated water, stir, and serve.",http://www.thecocktaildb.com/images/media/drink/pe1x1c1504735672.jpg,sour,gin,2 oz,lemon,juice of 1/2,powdered sugar,1 tsp,egg,1 whole,carbonated water,,,,,,,,,,,,,,,
929,Ruby Tuesday,"cocktail, ordinary drink",Pour gin and cranberry into a highball filled with ice cubes. Add grenadine and stir.,http://www.thecocktaildb.com/images/media/drink/qsyqqq1441553437.jpg,sour,gin,2 oz,cranberry juice,5 oz,grenadine,2 splashes,,,,,,,,,,,,,,,,,,
930,Rudolph's Rose,,Combine all ingredients and stir with ice in a mixing glass. Strain into coupe glass and garnish with a Luxardo Cherry.,,,christmas spirit,1.5 oz,luxardo maraschino liqueur,.25 oz,chateau de montifaud pineau des charentes rose,.5 oz,tempus fugit gran classico bitter,.75 oz,,,,,,,,,,,,,,,,
931,Rum Cobbler,"ordinary drink, ordinary drink","In an old-fashioned glass, dissolve the sugar in the club soda. Add crushed ice until the glass is almost full. Add the rum. Stir well. Garnish with the cherry and the orange and lemon slices.",http://www.thecocktaildb.com/images/media/drink/5vh9ld1504390683.jpg,sour,sugar,1 tsp superfine,club soda,3 oz,lemon,1,dark rum,2 oz,maraschino cherry,1,orange,1,,,,,,,,,,,,
932,Rum Cooler,"ordinary drink, ordinary drink",Pour the rum and soda into a collins glass almost filled with ice cubes. Stir well and garnish with the lemon wedge.,http://www.thecocktaildb.com/images/media/drink/2hgwsb1504888674.jpg,sweet,rum,2 oz light or dark,lemon-lime soda,4 oz,lemon,1,,,,,,,,,,,,,,,,,,
933,Rum Milk Punch,"ordinary drink, ordinary drink",Shake all ingredients (except nutmeg) with ice and strain into a collins glass. Sprinkle nutmeg on top and serve.,http://www.thecocktaildb.com/images/media/drink/w64lqm1504888810.jpg,,light rum,2 oz,milk,1 cup,powdered sugar,1 tsp,nutmeg,,,,,,,,,,,,,,,,,
934,Rum Old-fashioned,"ordinary drink, punch , party drink","Stir powdered sugar, water, and bitters in an old-fashioned glass. When sugar has dissolved add ice cubes and light rum. Add the twist of lime peel, float 151 proof rum on top, and serve.",http://www.thecocktaildb.com/images/media/drink/otn2011504820649.jpg,,light rum,1 1/2 oz,151 proof rum,1 tsp,powdered sugar,1/2 tsp,bitters,1 dash,water,1 tsp,lime peel,twist of,,,,,,,,,,,,
935,Rum Punch,"punch , party drink, punch , party drink",Mix all ingredients in a punch bowl and serve.,http://www.thecocktaildb.com/images/media/drink/wyrsxu1441554538.jpg,sweet,rum,mikey bottle,ginger ale,large bottle,fruit punch,355 ml frozen,orange juice,355 ml frozen,ice,crushed,,,,,,,,,,,,,,
936,Rum Runner,"punch , party drink, ordinary drink",Mix all ingredients in glass & add ice.,http://www.thecocktaildb.com/images/media/drink/vqws6t1504888857.jpg,,malibu rum,1 1/2 oz,blackberry brandy,1 oz,orange juice,3-4 oz,pineapple juice,3-4 oz,cranberry juice,3-4 oz,,,,,,,,,,,,,,
937,Rum Screwdriver,"ordinary drink, ordinary drink","Pour rum into a highball glass over ice cubes. Add orange juice, stir, and serve.",http://www.thecocktaildb.com/images/media/drink/pwl7v81504886372.jpg,,light rum,1 1/2 oz,orange juice,5 oz,,,,,,,,,,,,,,,,,,,,
938,Rum Sour,"ordinary drink, ordinary drink","In a shaker half-filled with ice cubes, combine the rum, lemon juice, and sugar. Shake well. Strain into a sour glass and garnish with the orange slice and the cherry.",http://www.thecocktaildb.com/images/media/drink/bylfi21504886323.jpg,,light rum,2 oz,lemon juice,1 oz,sugar,1/2 tsp superfine,orange,1,maraschino cherry,1,,,,,,,,,,,,,,
939,Rum Toddy,"ordinary drink, ordinary drink",Dissolve powdered sugar in water in an old-fashioned glass. Add rum and one ice cube and stir. Add the twist of lemon peel and serve.,http://www.thecocktaildb.com/images/media/drink/athdk71504886286.jpg,sour,rum,2 oz light or dark,powdered sugar,2 tsp,lemon peel,1 twist of,water,2 tsp,,,,,,,,,,,,,,,,
940,Russian Spring Punch,"ordinary drink, ordinary drink","Pour the ingredients into an highball glass, top with Sparkling wine.",http://www.thecocktaildb.com/images/media/drink/ctt20s1504373488.jpg,,vodka,2.5 cl,creme de cassis,1.5 cl,sugar syrup,1 cl,lemon juice,2.5 cl,,,,,,,,,,,,,,,,
941,Rusty Nail,"ordinary drink, ordinary drink",Pour the Scotch and Drambuie into an old-fashioned glass almost filled with ice cubes. Stir well. Garnish with the lemon twist.,http://www.thecocktaildb.com/images/media/drink/yqsvtw1478252982.jpg,salty,scotch,1 1/2 oz,drambuie,1/2 oz,lemon peel,1 twist of,,,,,,,,,,,,,,,,,,
942,Rx Hot Toddy,,Add ingredients to a mug and stir.. . *Honey-Ginger Syrup:. Combine 1 part ginger with 2 parts honey and 1 cup of water and boil. Reduce heat and simmer for 5 mins. Strain and discard solids.. . **Ghost-Pepper-Infused Campari:. Soak 1 ghost pepper in a 16 oz. bottle of Campari for up to 24 hrs (reduce infusion time to reduce heat).. . ***Cinnamon Tincture:. Soak 3 cinnamon sticks in 16 oz. of any neutral grain alcohol that is high proof (regular 80-proof vodka is great) for up to 14 days. Strain and discard the sticks.,,,old potrero straight rye whiskey,1.5 oz,lemon juice,.5 oz,cold-pressed apple cider,2 oz,hot water,2 oz,honey-ginger syrup*,.5 oz,ghost-pepper-infused campari**,1 tsp,cinnamon tincture***,3 dash,,,,,,,,,,
943,Sabotage,,"Muddle sage and Thyme. Stirred, over ice in single rocks glass. Burnt orange, and thyme sprig to garnish.",,,breck bourbon,2 oz,dancing pines black walnut bourbon,.5 oz,punt e mes,.5 oz,king's ginger liqueur,.25 oz,,,,,,,,,,,,,,,,
944,Sade's Taboo,,"Stir all the ingredients over ice, then strain into a coupe. No garnish.",,,h by hine,2 oz,cocchi americano,.75 oz,dolin rouge vermouth,.75 oz,bittermens hopped grapefruit bitters,1 dash,,,,,,,,,,,,,,,,
945,Sage & Sound,,"Muddle the sage in a mixing tin. Add the remaining ingredients and dry shake (no ice) for 15 seconds. Add ice and shake another 15 seconds to chill down the drink. Double strain into a large coupe glass. Garnish with a whole star anise floated in the middle of the egg white.. . *Honey Cinnamon Syrup:. -- 16 oz Honey. -- 2 Cinnamon Sticks. -- 8 oz Water. Combine all the ingredients together in a pot. Place on the stove and bring to a simmer, stirring the honey so it doesn’t burn and let the pot simmer for 20 minutes. Remove from heat and place on an ice bath. Place in a container and label and date it. Store in the fridge for up to 2 weeks.",,,junipero gin,1.5 oz,white port,1 oz,lemon juice,.75 oz,honey cinnamon syrup*,.5 oz,whole egg,1,muddled sage leaves,8,,,,,,,,,,,,
946,Sahara Glowing Heart,,"Combine all ingredients in a mixing glass, add ice and then stir. Strain into a Nick & Nora glass and garnish with a lemon twist.",,,junipero gin,1.5 oz,apricot eau-de-vie,.75 oz,grenadine,.25 oz,lemon bitters,2 dash,absinthe,2 dash,,,,,,,,,,,,,,
947,Salty Dog,"ordinary drink, ordinary drink","Pour all ingredients over ice cubes in a highball glass. Stir well and serve. (Vodka may be substituted for gin, if preferred.)",http://www.thecocktaildb.com/images/media/drink/4vfge01504890216.jpg,salty,grapefruit juice,5 oz,gin,1 1/2 oz,salt,1/4 tsp,,,,,,,,,,,,,,,,,,
948,Salty Swede,,Combine the Karlsson's Gold Vodka and grapefruit in a shaker with ice. Shake for 15 seconds and strain over fresh ice in an old-fashioned glass that has a salted rim. Top the cocktail with the club soda.,,,karlsson's gold vodka,2 oz,fresh grapefruit juice,2 oz,club soda,1 oz,ure grapefruit bitters,1 tinc,,,,,,,,,,,,,,,,
949,San Fran Shandy,,"Combine Hophead, lemon juice, King's Ginger, honey syrup, egg white, and bitters in a shaker and dry shake to emulsify egg whites. Add ice and shake vigorously until proper dilution. Strain into a chilled fizz glass. Empty ice out of shakers and fill shaker with ale to create a froth. Pour this froth over the drink and garnish with half an orange wheel.. 	. ",,,hophead vodka,2 oz,king's ginger liqueur,.5 oz,breckle's brown ale,3 oz,fresh lemon juice,1 oz,honey syrup,.5 oz,egg white,.5 oz,angostura bitters,2 dash,,,,,,,,,,
950,San Fran Soda,,"Pour over ice in a pint glass, then fill with steam beer. Garnish with a lemon wedge and a straw.",,,hophead vodka,1.25 oz,fresh lime juice,.5 oz,soda water,splash,steam beer,top,,,,,,,,,,,,,,,,
951,San Francisco,"ordinary drink, punch , party drink","Take a tall glass and put in a few ice cubes, fill the vodka over it and fill with juice then the ""creme"", to end fill in the grenadine but very carefully at the side of the glass so it will lay down in the bottom. garnish with orange and strawberry.",http://www.thecocktaildb.com/images/media/drink/szmj2d1504889961.jpg,sweet,vodka,2 cl,creme de banane,2 cl,grenadine,,orange juice,,,,,,,,,,,,,,,,,
952,San Francisco Harvest,,Combine ingredients in a shaker with ice. Shake and double strain into a coupe glass. Garnish with nutmeg.. . *Winter Spice Brown Sugar Syrup: . -- 2 qt Brown Sugar. -- 2 qt Water. -- 3 Tbsp Ground Ginger. -- 3 Tbsp Ground Nutmeg. -- 1 Tbsp Clove. . Heat and simmer the below ingredients in a medium pot for 15 minutes. Strain with cheesecloth.,,,junipero gin,1.5 oz,oloroso sherry,.75 oz,lemon juice,.75 oz,winter spice brown sugar syrup*,.75 oz,pineapple juice,1 oz,,,,,,,,,,,,,,
953,San Francisco Strong (Skrong),,"Add all ingredients to tin and dry shake. Add ice and vigorously shake for 12 seconds. Fine strain into chilled cocktail glass. Garnish by sprinkling matcha powder (.25 tsp). . . *Rich Simple Syrup: . -- 2 cups Granulated Sugar. -- 1 cup Water. . Combine sugar and water in a small saucepan over medium heat and stir until sugar dissolves. Remove from heat, let cool to room temperature and transfer to a clean glass jar. Cover and keep refrigerated for up to 2 weeks.",,,junipero gin,.75 oz,tempus fugit kina l'aero d'or,.75 oz,luxardo bitter bianco,.75 oz,lemon juice,.75 oz,egg whites,.75 oz,rich simple syrup*,.5 oz,,,,,,,,,,,,
954,Sangria #1,"punch , party drink, punch , party drink",Mix all together in a pitcher and refrigerate. Add cloves and cinnamon sticks to taste. Serve in wine glasses.,http://www.thecocktaildb.com/images/media/drink/xrvxpp1441249280.jpg,,red wine,1 bottle,sugar,1/2 cup,orange juice,1 cup,lemon juice,1 cup,cloves,,cinnamon,,,,,,,,,,,,,
955,Sangria - The World's Best,"punch , party drink, ordinary drink","Mix wine, sugar and fruit, and let sit in the fridge for 18-24 hours. The mixture will have a somewhat syrupy consistency. Before serving stir in brandy and cut the mixture with soda water until it have a thinner, more wine like consistency. Serve from a pitcher in wine glasses.",http://www.thecocktaildb.com/images/media/drink/vysywu1468924264.jpg,,red wine,1 1/2 l,sugar,1 cup,lemon,1 large,orange,1 large,apple,1 large,brandy,3-4 oz plain,soda water,,,,,,,,,,,
956,Santa Patricia,,Shake all ingredients very well with ice and strain over ice into a highball glass.,,,blanco tequila,1 oz,dry curacao,.5 oz,luxardo bitter,.5 oz,fresh ruby red grapefruit juice,.75 oz,cinnamon syrup,.5 oz,,,,,,,,,,,,,,
957,Sazerac,"ordinary drink, ordinary drink","Rinse a chilled old-fashioned glass with the absinthe, add crushed ice, and set it aside. Stir the remaining ingredients over ice and set it aside. Discard the ice and any excess absinthe from the prepared glass, and strain the drink into the glass. Add the lemon peel for garnish.",http://www.thecocktaildb.com/images/media/drink/vvpxwy1439907208.jpg,cream,ricard,1 tsp,sugar,1/2 tsp superfine,peychaud bitters,2 dashes,water,1 tsp,bourbon,2 oz,lemon peel,1 twist of,,,,,,,,,,,,
