,drink_name,category,instructions,picture,taste,ingredients1,quantity1,ingredients2,quantity2,ingredients3,quantity3,ingredients4,quantity4,ingredients5,quantity5,ingredients6,quantity6,ingredients7,quantity7,ingredients8,quantity8,ingredients9,quantity9,ingredients10,quantity10,ingredients11,quantity11,ingredients12,quantity12
0,#106 Cocktail,,Shake and double strain into a coupe. Garnish with sage.. . *Pear Syrup:. -- Pear. -- Sage. -- White Pepper. -- Star Anise,,,chinaco blanco tequila,1 oz,luxardo bitter bianco,1 oz,pear syrup*,.5 oz,lemon juice,.5 oz,grey sea salt,pinc,,,,,,,,,,,,,,
1,'57 Chevy with a White License Plate,"cocktail, shot",1. Fill a rocks glass with ice 2.add white creme de cacao and vodka 3.stir,http://www.thecocktaildb.com/images/media/drink/qyyvtu1468878544.jpg,,creme de cacao,1 oz white,vodka,1 oz,,,,,,,,,,,,,,,,,,,,
2,1-900-FUK-MEUP,"shot, beer",Shake ingredients in a mixing tin filled with ice cubes. Strain into a rocks glass.,http://www.thecocktaildb.com/images/media/drink/uxywyw1468877224.jpg,,absolut kurant,1/2 oz,grand marnier,1/4 oz,chambord raspberry liqueur,1/4 oz,midori melon liqueur,1/4 oz,malibu rum,1/4 oz,amaretto,1/4 oz,cranberry juice,1/2 oz,pineapple juice,1/4 oz,,,,,,,,
3,10 to 7,,Shake and serve up in a martini glass with lemon peel rind.,,,no. 209 gin,1 oz,luxardo maraschino liqueur,1 oz,st. germain,1 oz,lemon juice,1 oz,,,,,,,,,,,,,,,,
4,110 in the shade,"beer, milk , float , shake",Drop shooter in glass. Fill with beer,http://www.thecocktaildb.com/images/media/drink/xxyywq1454511117.jpg,,lager,16 oz,tequila,1.5 oz,,,,,,,,,,,,,,,,,,,,
5,151 Florida Bushwacker,"milk , float , shake, cocktail",Combine all ingredients. Blend until smooth. Garnish with chocolate shavings if desired.,http://www.thecocktaildb.com/images/media/drink/rvwrvv1468877323.jpg,,malibu rum,1/2 oz,light rum,1/2 oz,151 proof rum,1/2 oz bacardi,dark creme de cacao,1 oz,cointreau,1 oz,milk,3 oz,coconut liqueur,1 oz,vanilla ice-cream,1 cup,,,,,,,,
6,155 Belmont,"cocktail, shot",Blend with ice. Serve in a wine glass. Garnish with carrot.,http://www.thecocktaildb.com/images/media/drink/yqvvqs1475667388.jpg,,dark rum,1 shot,light rum,2 shots,vodka,1 shot,orange juice,1 shot,,,,,,,,,,,,,,,,
7,1880's Americana,,Build over ice in Old Fashioned glass.,,,hirsch small batch reserve bourbon,2 oz,amer picon,10 ml,house cola syrup,10 ml,,,,,,,,,,,,,,,,,,
8,20th Century,,Shake with ice. Strain into a chilled cocktail glass.,,,no.3 london dry gin,1.5 oz,tempus fugit kina l'aero d'or,.75 oz,tempus fugit creme de cacao,.75 oz,fresh lemon juice,.75 oz,,,,,,,,,,,,,,,,
9,24k nightmare,"shot, shot","Add over ice,shake and pour.",http://www.thecocktaildb.com/images/media/drink/yyrwty1468877498.jpg,,goldschlager,1/2 oz,jägermeister,1/2 oz,rumple minze,1/2 oz,151 proof rum,1/2 oz bacardi,,,,,,,,,,,,,,,,
10,252,"shot, shot","Add both ingredients to shot glass, shoot, and get drunk quick",http://www.thecocktaildb.com/images/media/drink/rtpxqw1468877562.jpg,,151 proof rum,1/2 shot bacardi,wild turkey,1/2 shot,,,,,,,,,,,,,,,,,,,,
11,3 & Tree,,Pour No.3 into ice-filled collins glass. Top off with Fever-Tree Tonic Water to just below rim of the glass. Float .25 oz. of Maurin Quina on top of cocktail. Garnish with small spoonful of fresh pomegranate seeds.,,,no.3 london dry gin,1.5 oz,fever-tree tonic water,top,maurin quina,.25 oz,,,,,,,,,,,,,,,,,,
12,3 & Tree Tonic,,,,,no.3 london dry gin,1.5 oz,fever-tree tonic water,top,,,,,,,,,,,,,,,,,,,,
13,3 Degrees,,"Combine all ingredients with ice, shake, strain into martini glass, top with prosecco, garnish with sage.",,,no.3 london dry gin,1.75 oz,velvet falernum,.75 oz,lime juice,.5 oz,pear sage foam,.5 oz,prosecco,1 float,,,,,,,,,,,,,,
14,3 Wise Men,"shot, ordinary drink",put them them in a glass... and slam it to tha head.,http://www.thecocktaildb.com/images/media/drink/wxqpyw1468877677.jpg,,jack daniels,1/3 oz,johnnie walker,1/3 oz,jim beam,1/3 oz,,,,,,,,,,,,,,,,,,
15,3-Mile Long Island Iced Tea,"ordinary drink, ordinary drink",Fill 14oz glass with ice and alcohol. Fill 2/3 glass with cola and remainder with sweet & sour. Top with dash of bitters and lemon wedge.,http://www.thecocktaildb.com/images/media/drink/rrtssw1472668972.jpg,sweet,gin,1/2 oz,light rum,1/2 oz,tequila,1/2 oz,triple sec,1/2 oz,vodka,1/2 oz,coca-cola,,sweet and sour,1-2 dash,bitters,1 wedge,lemon,,,,,,,
16,3AM,,Shake all ingredients with ice and strain into an iced up glass.,,,no.3 london dry gin,1.5 oz,h by hine,.75 oz,luxardo triplum (triple sec),.75 oz,king's ginger liqueur,.5 oz,fresh lime juice,.5 oz,,,,,,,,,,,,,,
17,410 Gone,"ordinary drink, ordinary drink",fill glass with crushed ice. Add vodka. Add a splash of grand-marnier. Fill with o.j.,http://www.thecocktaildb.com/images/media/drink/xtuyqv1472669026.jpg,sweet,peach vodka,2-3 oz,coca-cola, ,,,,,,,,,,,,,,,,,,,,
18,50/50,"ordinary drink, ordinary drink",fill glass with crushed ice. Add vodka. Add a splash of grand-marnier. Fill with o.j.,http://www.thecocktaildb.com/images/media/drink/wwpyvr1461919316.jpg,sour,vanilla vodka,2 1/2 oz,grand marnier,1 splash,orange juice,fill with,,,,,,,,,,,,,,,,,,
19,50/50 Split,,Stir gently and garnish with a lemon twist.,,,junipero gin,1.5 oz,dry vermouth,.75 oz,tempus fugit alessio vermouth bianco,.75 oz,the bitter truth orange bitters,1 dash,,,,,,,,,,,,,,,,
20,501 Blue,"ordinary drink, ordinary drink",Mix equal amounts into a glass with ice.,http://www.thecocktaildb.com/images/media/drink/ywxwqs1461867097.jpg,sweet,blue curacao,,blueberry schnapps,,vodka,,sour mix,,7-up,,,,,,,,,,,,,,,
21,69 Special,"ordinary drink, shot","Pour 2 oz. gin. Add 4 oz. 7-up. Add Lemon Juice for flavor. If you are weak, top up glass with more 7-Up.",http://www.thecocktaildb.com/images/media/drink/vqyxqx1472669095.jpg,,gin,2 oz dry,7-up,4 oz,lemon juice,0.75 oz,,,,,,,,,,,,,,,,,,
22,747,"shot, cocktail","pour kaluha, then Baileys, then Frangelico not chilled and not layered -- SERVE!!!",http://www.thecocktaildb.com/images/media/drink/xxsxqy1472668106.jpg,,kahlua,1/3 part,bailey's irish cream,1/3 part,frangelico,1/3 part,,,,,,,,,,,,,,,,,,
23,7th Heaven,,Shake all ingredients in an iced-filled cocktail shaker. Strain into chilled martini glass or cocktail coupe.,,,no.3 london dry gin,1.5 oz,luxardo maraschino liqueur,.5 oz,grapefruit juice,1 oz,pages elderflower syrup,.25 oz,angostura bitters,1 dash,,,,,,,,,,,,,,
24,9 1/2 Weeks,"cocktail, ordinary drink",Combine all ingredients in glass mixer. Chill and strain into Cocktail glass. Garnish with sliced strawberry.,http://www.thecocktaildb.com/images/media/drink/xvwusr1472669302.jpg,sweet,absolut citron,2 oz,orange curacao,1/2 oz,strawberry liqueur,1 splash,orange juice,1 oz,,,,,,,,,,,,,,,,
25,A Bloody Shame,,"Shaken and strained into a large coupe. Garnish with a dehydrated lime wheel soaked in Angostura Bitters.. . *Blood Orange Vanilla Mint Puree:. -- 1 container Boiron Blood Orange Puree (34 oz.). -- 39 grams Mint (stems and leaves). -- 1 tsp Vanilla Extract. -- 30 oz White Sugar. . Combine all the ingredients except the mint in a pot. . Bring to a light simmer, stirring to incorporate everything.. Then add the mint and cook for 5 minutes, then remove the pot from the heat and strain through a chinois to remove the mint.. Label and date a container, then place in your fridge. Use within a week.",,,vodka,1.5 oz,luxardo amaretto di saschira,.5 oz,blood orange vanilla mint puree*,.75 oz,lime juice,.75 oz,,,,,,,,,,,,,,,,
26,A Botanical Garden,,"Combine all ingredients in a shaking tin and give it a short shake, five seconds. Strain into an old fashined glass with three medium sized ice cubes.",,,hophead vodka,1.5 oz,zirbenz stone pine,.75 oz,fresh strawberry juice w/ xanthan gum*,.75 oz,lemon juice,.75 oz,simple syrup,.5 oz,,,,,,,,,,,,,,
27,A Day at the Beach,"ordinary drink, ordinary drink","Shake Rum, Amaretto, and Orange Juice in a shaker filled with ice. Strain over ice into a highball glass. Add Grenadine and garnish with a Pineapple Wedge and a Strawberry.",http://www.thecocktaildb.com/images/media/drink/trptts1454514474.jpg,sweet,coconut rum,1 oz,amaretto,1/2 oz,orange juice,4 oz,grenadine,1/2 oz,,,,,,,,,,,,,,,,
28,A Furlong Too Late,"ordinary drink, cocktail",Pour the rum and ginger beer into a highball glass almost filled with ice cubes. Stir well. Garnish with the lemon twist.,http://www.thecocktaildb.com/images/media/drink/ssxvww1472669166.jpg,,light rum,2 oz,ginger beer,4 oz,lemon peel,1 twist of,,,,,,,,,,,,,,,,,,
29,A Gift from Zara,,Build all ingredients except for the Topo Chico in a wine glass. Fill the glass with cubed ice then top with Topo Chico by pouring it down a barspoon to incorporate. Zest the top with orange and place it in the glass. Add edible flowers for aroma and aesthetic.,,,luxardo bitter bianco,1.5 oz,london dry gin,.75 oz,elderflower liqueur,.75 oz,citric acid,2 dash,orange flower water,4 drops,topo chico mineral water,2.5 oz,,,,,,,,,,,,
30,A Gilligan's Island,"cocktail, ordinary drink","Shaken, not stirred!",http://www.thecocktaildb.com/images/media/drink/wysqut1461867176.jpg,sweet,vodka,1 oz,peach schnapps,1 oz,orange juice,3 oz,cranberry juice,3 oz,,,,,,,,,,,,,,,,
31,A Love Song,,Combine all ingredients besides blood orange into a mixing glass and stir until proper dilution (15-20 seconds). Pour into a small martini glass. Rub a thin slice of blood orange around the rim and place in drink.,,,no.3 london dry gin,1 oz,maurin quina,1 oz,luxardo bitter,.5 oz,king's ginger liqueur,.5 oz,,,,,,,,,,,,,,,,
32,A Mi Manera (My Way) Pisco Punch,,"Mix the Pisco, apricot liqueur and citric acid ingredients together in a punch bowl and allow to rest for 45 minutes. Place a large 2.2 lb. ice block 10 minutes before serving. Scoop the pineapple sorbet in a punch glass and fill up with the mix, top up with mint-flavored soda. Garnish with candied pineapple wheel from Dress the Drink.",,,barsol selecto italia pisco,2 oz,luxardo apricot liqueur,1 oz,minta soda,2 oz,citric acid or lime juice,1 pinc,op pineapple sorbet,1 sc,,,,,,,,,,,,,,
33,A midsummernight dream,"ordinary drink, ordinary drink","Mix the strawberrys in a blender Pour it together with the vodka,kirch and strawberry liquer over ice in a shaker. Shake well and pour in a highballglass. Fill up with the Russchian water",http://www.thecocktaildb.com/images/media/drink/ysqvqp1461867292.jpg,bitter,vodka,2 oz,kirschwasser,1 oz,strawberry liqueur,1 tsp,strawberries,5,schweppes russchian,,,,,,,,,,,,,,,
34,A Night In Old Mandalay,"ordinary drink, other,unknown","In a shaker half-filled with ice cubes, combine the light rum, añejo rum, orange juice, and lemon juice. Shake well. Strain into a highball glass almost filled with ice cubes. Top with the ginger ale. Garnish with the lemon twist.",http://www.thecocktaildb.com/images/media/drink/vyrvxt1461919380.jpg,sour,light rum,1 oz,añejo rum,1 oz,orange juice,1 oz,lemon juice,1/2 oz,ginger ale,3 oz,lemon peel,1 twist of,,,,,,,,,,,,
35,A Piece of Ass,"other,unknown, shot",Put ice in glass. Pour in shots. Fill with Sour Mix.,http://www.thecocktaildb.com/images/media/drink/tqxyxx1472719737.jpg,,amaretto,1 shot,southern comfort,1 shot,ice,cubes,sour mix,,,,,,,,,,,,,,,,,
36,A Regal Air,,Combine these ingredients and roll gently over ice and strain into a martini glass. Top with pumpkin foam.,,,domingo perez marin 'la guita' manzanilla sherry,3 oz,king's ginger liqueur,.5 oz,chartreuse,.25 oz,juice of an orange,.25 oz,,,,,,,,,,,,,,,,
37,A Southern Jackass,,"Fill a shaker with an old fashioned glass worth of ice. Add all ingredients except for the club soda. Shake vigorously for 20 seconds, then dump into old fashioned glass. Set lemon wheel and sliver of cinnamon-candied ginger on top then top with club soda.. . *Cinnamon Candied Ginger Syrup:. Combine 1/4 lb. peeled ginger root (sliced 1/8"" on a 45-degree bias using a mandolin), 2 cups of water, and 4 cinnamon sticks in a pot (or pan) and bring to cusp of a light simmer. Continue to barely simmer for 30 minutes. Add 1 cup of demerara sugar and stir until fully dissolved. Lower heat and keep just below simmering. Continue to heat until almost all liquid is reduced and remaining sugar is just beginning to caramelize (2-3 hours). Remove from heat and spoon slivers of ginger (along with a generous dollop of now thick syrup) onto a sheet of parchment or wax paper. Let cool for at least 2 hours then store layered on the paper sealed in a ziplock bag. Remove cinnamon sticks and reserve syrup.",,,prichard's lincoln county lightning,1.5 oz,king's ginger liqueur,.5 oz,cinnamon-candied ginger syrup*,.5 oz,angostura bitters,3 dash,club soda,top,,,,,,,,,,,,,,
38,A Splash of Nash,"shot, cocktail",Drop shot glass with banana & melon liquers into a 9 oz hi- ball glass containing soda water and cranberry juice. Drink in one shot.,http://www.thecocktaildb.com/images/media/drink/rsvtrr1472668201.jpg,sour,cranberry juice,2 oz,soda water,2 oz,midori melon liqueur,0.5 oz,creme de banane,0.5 oz,,,,,,,,,,,,,,,,
39,A Tall Tell,,Combine all the ingredients except Prosecco. Add a large block of ice or large ice cubes and stir. Top with Prosecco. Garnish with orange wheels studded with cloves and float some mint sprigs in the bowl.,,,c. drouin calvados selection,9 oz,marrakesh mint tea,6 oz,prosecco,6 oz,king's ginger liqueur,3 oz,lemon juice,2 oz,velvet falernum,1.5 oz,dale degroff's pimento aromatic bitters,.5 oz,,,,,,,,,,
40,A True Amaretto Sour,"cocktail, ordinary drink","Rub the rim of an old fashioned glass with lemon, and dip repeatedly into granulated sugar until it has a good ""frosted"" rim. Shake a jigger of Amaretto with the juice of 1/2 a lemon. Strain into glass and add ice. Garnish with a Marachino Cherry.",http://www.thecocktaildb.com/images/media/drink/rptuxy1472669372.jpg,sweet,amaretto,1 jigger,lemon,juice of 1/2,ice,,maraschino cherry,,,,,,,,,,,,,,,,,
41,A. J.,"ordinary drink, cocktail","Shake ingredients with ice, strain into a cocktail glass, and serve.",http://www.thecocktaildb.com/images/media/drink/uryyrr1472811418.jpg,cream,applejack,1 1/2 oz,grapefruit juice,1 oz,,,,,,,,,,,,,,,,,,,,
42,A.D.M. (After Dinner Mint),"cocktail, cocktail",shake vigorously,http://www.thecocktaildb.com/images/media/drink/ruxuvp1472669600.jpg,sweet,white creme de menthe,1/2 oz,southern comfort,3/4 oz,vodka,1/2 oz,hot chocolate,fill with,,,,,,,,,,,,,,,,
43,A.Nise,,Add all ingredients into a shaker with ice. Shake. Strain over fresh ice into a rocks glass. Garnish with star anise and two slices lemongrass.,,,pink pigeon rum,1.5 oz,luxardo amaretto di saschira,.5 oz,osha falernum,.5 oz,lemon juice,.5 oz,pineapple juice,1 oz,orange bitters,3 dash,,,,,,,,,,,,
44,A1,"cocktail, shot","Pour all ingredients into a cocktail shaker, mix and serve over ice into a chilled glass.",http://www.thecocktaildb.com/images/media/drink/2x8thr1504816928.jpg,,gin,1 3/4 shot,grand marnier,1 shot,lemon juice,1/4 shot,grenadine,1/8 shot,,,,,,,,,,,,,,,,
45,Abano Sour,,Shake ingredients with ice then strain into a sour cocktail glass previously rimmed with cardamom sugar.,,,luxardo amaro abano,1.5 oz,fresh lemon juice,1 oz,agave nectar,.25 oz,grapefruit bitters,1 dash,egg white,.5 oz,,,,,,,,,,,,,,
46,Abbey Cocktail,"ordinary drink, cocktail",Shake all ingredients (except for the cherry) with ice and strain into a cocktail glass. Top with the cherry and serve.,http://www.thecocktaildb.com/images/media/drink/quyyuw1472811568.jpg,,gin,1 1/2 oz,orange bitters,1 dash,orange,juice of 1/4,cherry,1,,,,,,,,,,,,,,,,
47,Abbey Martini,"cocktail, ordinary drink","Put all ingredients into a shaker and mix, then strain contents into a chilled cocktail glass.",http://www.thecocktaildb.com/images/media/drink/2mcozt1504817403.jpg,sweet,gin,2 shots,sweet vermouth,1 shot,orange juice,1 shot,angostura bitters,3 dashes,,,,,,,,,,,,,,,,
48,ABC,"shot, shot",Layered in a shot glass.,http://www.thecocktaildb.com/images/media/drink/tqpvqp1472668328.jpg,,amaretto,3-jan,bailey's irish cream,3-jan,cognac,3-jan,,,,,,,,,,,,,,,,,,
49,Abilene,"ordinary drink, other,unknown",Pour all of the ingredients into a highball glass almost filled with ice cubes. Stir well.,http://www.thecocktaildb.com/images/media/drink/ysqwwt1461919465.jpg,,dark rum,1 1/2 oz,peach nectar,2 oz,orange juice,3 oz,,,,,,,,,,,,,,,,,,
50,Above My Pay Grade,,Stir and strain.,,,semper fi white whiskey,1.5 oz,chateau de montifaud pineau des charentes rose,.75 oz,tempus fugit gran classico bitter,.75 oz,house-made citrus bitters,3 dash,,,,,,,,,,,,,,,,
51,Abrazo Latino,,Stir ingredients in a mixing glass filled with ice then strain into a chilled cocktail coupe.,,,chinaco reposado tequila,1.5 oz,luxardo amaro abano,.75 oz,luxardo triplum (triple sec),.75 oz,,,,,,,,,,,,,,,,,,
52,Absinthe #2,homemade liqueur,"Mix together and let sit a few days. Strain through a coffee filter. To serve mix 1 part absinthe to 4 parts water, add ice, enjoy.",http://www.thecocktaildb.com/images/media/drink/uxxtrt1472667197.jpg,,vodka,1 bottle,sugar,50 gr,anise,50 ml pure,licorice root,1 tblsp,wormwood,1,,,,,,,,,,,,,,
53,Absolut Evergreen,"other,unknown, shot","Mix, pour over ice and top up with Bitter Lemon.",http://www.thecocktaildb.com/images/media/drink/wrxrxp1472812609.jpg,,absolut citron,2/3 part,pisang ambon,1/3 part,ice,cubes,bitter lemon,,,,,,,,,,,,,,,,,
54,Absolut limousine,"other,unknown, ordinary drink",Fill Absolut into a glass. Add Lime juice. Add Ice and lime wedges.,http://www.thecocktaildb.com/images/media/drink/ssqpyw1472719844.jpg,sweet,absolut citron,3-feb,lime juice,3-jan,ice,fill with,tonic water,top it up with,,,,,,,,,,,,,,,,
55,Absolut Sex,"shot, ordinary drink","Shake Absolut Kurant, Midori, and Cranberry juice in shaker with ice: Strain into rocks glass: Splash of seven on top.Absolut Sex.",http://www.thecocktaildb.com/images/media/drink/xtrvtx1472668436.jpg,sweet,absolut kurant,3/4 oz,midori melon liqueur,3/4 oz,cranberry juice,1 oz,sprite,1 splash,,,,,,,,,,,,,,,,
56,Absolut Stress #2,"ordinary drink, cocktail",Mix well. Garnish with Orange and Cherry. Enjoy,http://www.thecocktaildb.com/images/media/drink/xuyqrw1472811825.jpg,,absolut vodka,1 1/2 oz,peach schnapps,1/2 oz,coconut liqueur,1/2 oz,cranberry juice,1 1/2 oz,pineapple juice,1 1/2 oz,,,,,,,,,,,,,,
57,Absolut Summertime,"cocktail, other,unknown",Add all ingredients except lemon to shaker filled with ice. Cover and shake vigorously. Strain contents into ice filled collins glass. Garnish with lemon.,http://www.thecocktaildb.com/images/media/drink/trpxxs1472669662.jpg,sour,absolut citron,1 1/2 oz,sweet and sour,3/4 oz,sprite,1/2 oz,soda water,3 oz,lemon,1 slice,,,,,,,,,,,,,,
58,Absolutely Cranberry Smash,"ordinary drink, cocktail",Stir ingredients together. Serve over ice.,http://www.thecocktaildb.com/images/media/drink/vqwstv1472811884.jpg,,absolut vodka,2 oz,cranberry juice,4 oz,ginger ale,2 oz,ice,add,,,,,,,,,,,,,,,,
59,Absolutely Fabulous,"cocktail, cocktail",Mix the Vodka and Cranberry juice together in a shaker and strain into a glass. Top up with Champagne.,http://www.thecocktaildb.com/images/media/drink/abcpwr1504817734.jpg,sweet,vodka,1 shot,cranberry juice,2 shots,champagne,top up with,,,,,,,,,,,,,,,,,,
60,Absolutly Screwed Up,"cocktail, ordinary drink","Shake it up it tasts better that way, but you can stir it if you want. 6 of those and you will be wasted for the rest of the night.",http://www.thecocktaildb.com/images/media/drink/yvxrwv1472669728.jpg,mint,absolut citron,1 shot,orange juice,1 shot,triple sec,1 shot,ginger ale,fill to top,,,,,,,,,,,,,,,,
61,Acapulco,"ordinary drink, cocktail",Combine and shake all ingredients (except mint) with ice and strain into an old-fashioned glass over ice cubes. Add the sprig of mint and serve.,http://www.thecocktaildb.com/images/media/drink/vtpsvr1472811976.jpg,cream,light rum,1 1/2 oz,triple sec,1 1/2 tsp,lime juice,1 tblsp,sugar,1 tsp,egg white,1,mint,1,,,,,,,,,,,,
62,Ace,"cocktail, ordinary drink",Shake all the ingredients in a cocktail shaker and ice then strain in a cold glass.,http://www.thecocktaildb.com/images/media/drink/l3cd7f1504818306.jpg,sour,gin,2 shots,grenadine,1/2 shot,heavy cream,1/2 shot,milk,1/2 shot,egg white,1/2 fresh,,,,,,,,,,,,,,
63,ACID,"shot, ordinary drink",Poor in the 151 first followed by the 101 served with a Coke or Dr Pepper chaser.,http://www.thecocktaildb.com/images/media/drink/xuxpxt1479209317.jpg,water,151 proof rum,1 oz bacardi,wild turkey,1 oz,,,,,,,,,,,,,,,,,,,,
64,Across The Pond,,"Combine all ingredients except soda in a shaker with ice, shake to combine. Pour over ice in a rocks glass and top with soda. Garnish with a Luxardo cherry.. ",,,junipero gin,1 oz,king's ginger liqueur,1 oz,round pond meyer lemon syrup,.5 oz,fresh lemon juice,.75 oz,soda water,1 splash,,,,,,,,,,,,,,
65,Adam,"ordinary drink, cocktail","In a shaker half-filled with ice cubes, combine all of the ingredients. Shake well. Strain into a cocktail glass.",http://www.thecocktaildb.com/images/media/drink/rwuxsv1472812169.jpg,sour,dark rum,2 oz,lemon juice,1 oz,grenadine,1 tsp,,,,,,,,,,,,,,,,,,
66,Adam & Eve,"cocktail, punch , party drink",Shake together all the ingredients and strain into a cold glass.,http://www.thecocktaildb.com/images/media/drink/vfeumw1504819077.jpg,,gin,1 shot,cognac,1 shot,creme de cassis,1 shot,fresh lemon juice,1/8 shot,,,,,,,,,,,,,,,,
67,Adam Bomb,"punch , party drink, ordinary drink","Add ice to blender (or to glass if prefer on the rocks) then fruit, and fruite juice depending on personal prefference then add the Rum, Vodka, Tequila, and triple sec. blend till smooth, rim glass with sugar or salt and pour mixture in. garnish with lemon or lime slice.",http://www.thecocktaildb.com/images/media/drink/tpxurs1454513016.jpg,water,rum,1 part,vodka,1 part,tequila,1 part,triple sec,1/2 part,fruit,,ice,,salt,1-3 pint,fruit juice,,,,,,,,,
68,Adam Sunrise,"ordinary drink, cocktail","Fill blender up with ice. Fill half with Bartons Vodka. Put 10 tsp of sugar, add 1/2 can lemonade concentrate, fill to top with water. Blend for 60 seconds.",http://www.thecocktaildb.com/images/media/drink/vtuyvu1472812112.jpg,,vodka,2-jan,lemonade,1/2 can,water,2-jan,sugar,10 tsp,,,,,,,,,,,,,,,,
69,Addington,"cocktail, cocktail",Mix both the vermouth's in a shaker and strain into a cold glass. Top up with a squirt of Soda Water. ,http://www.thecocktaildb.com/images/media/drink/ib0b7g1504818925.jpg,,sweet vermouth,2 shots,dry vermouth,1 shot,soda water,top up with,,,,,,,,,,,,,,,,,,
70,Addison,"cocktail, cocktail",Shake together all the ingredients and strain into a cold glass.,http://www.thecocktaildb.com/images/media/drink/yzva7x1504820300.jpg,sweet,gin,1 1/2 shot,vermouth,1 1/2 shot,,,,,,,,,,,,,,,,,,,,
71,Addison Special,"cocktail, cocktail",Combine ingredients in the order listed into a shaker. Fill half full with ice and shake well. Strain into glass with ice and garnish with a cherry and orange wedge.,http://www.thecocktaildb.com/images/media/drink/4vo5651493068493.jpg,,vodka,1 shot,grenadine,1 tblsp,orange juice,fill with,,,,,,,,,,,,,,,,,,
72,Adios Amigos Cocktail,"cocktail, ordinary drink",Shake together all the ingredients and strain into a cold glass.,http://www.thecocktaildb.com/images/media/drink/8nk2mp1504819893.jpg,,rum,1 shot,dry vermouth,1/2 shot,cognac,1/2 shot,gin,1/2 shot,fresh lime juice,1/4 shot,sugar syrup,1/4 shot,water,1/2 shot,,,,,,,,,,
73,Adonis Cocktail,"ordinary drink, ordinary drink","Stir all ingredients with ice, strain contents into a cocktail glass, and serve.",http://www.thecocktaildb.com/images/media/drink/xrvruq1472812030.jpg,sweet,sweet vermouth,3/4 oz,sherry,1 1/2 oz dry,orange bitters,1 dash,,,,,,,,,,,,,,,,,,
74,Adriatique,,1. Add ingredients to cocktail shaker. 2. Fill shaker with ice and mix ingredients. 3. Strain cocktail into a chilled glass.,,fresh,amaro montenegro,3 cl,orange juice,3 cl,aperol,1.5 cl,,,,,,,,,,,,,,,,,,
75,Affair,"ordinary drink, ordinary drink","Pour schnapps, orange juice, and cranberry juice over ice in a highball glass. Top with club soda and serve.",http://www.thecocktaildb.com/images/media/drink/wxrsxx1472720734.jpg,,strawberry schnapps,2 oz,orange juice,2 oz,cranberry juice,2 oz,club soda,,,,,,,,,,,,,,,,,
76,Affinity,"ordinary drink, ordinary drink","In a mixing glass half-filled with ice cubes, combine all of the ingredients. Stir well. Strain into a cocktail glass.",http://www.thecocktaildb.com/images/media/drink/nwatpb1504817045.jpg,,scotch,1 1/2 oz,sweet vermouth,1 oz,dry vermouth,1 oz,orange bitters,2 dashes,,,,,,,,,,,,,,,,
77,After Dinner Cocktail,"ordinary drink, shot",Shake all ingredients (except lime wedge) with ice and strain into a cocktail glass. Add the wedge of lime and serve.,http://www.thecocktaildb.com/images/media/drink/vtytxq1483387578.jpg,,apricot brandy,1 oz,triple sec,1 oz,lime,juice of 1,lime,1,,,,,,,,,,,,,,,,
78,After Five,"shot, ordinary drink","1. Pour Kahlua into shot glass to about 1/2 full. 2. Using a spoon(inverted), slowly pour in the Peppermint Schnapps until glass is about 3/4 full. Done correctly, the Schnapps will flow under the Kahlua for a clear layer. 3. Again using a spoon, but this time right side up, slowly top off the glass with a layer of Bailey's. Be careful to place the spoon right at the top of the Kahlua layer and to raise it as the glass fills up. Done correctly, this will provide a layer of Bailey's floating over the Kahlua. 4. Toss it down all at once for something like a Peppermint Pattie, WITH A BANG!!! NOTE: Best if all ingredients are chilled",http://www.thecocktaildb.com/images/media/drink/sk3lr91493068595.jpg,,peppermint schnapps,,kahlua,,bailey's irish cream,,,,,,,,,,,,,,,,,,,
79,After sex,"ordinary drink, coffee , tea",Pour the vodka and creme over some ice cubes in a tall glass and fill up with juice. to make it beuty full make the top of the glass with a grenadine and sugar,http://www.thecocktaildb.com/images/media/drink/xrl66i1493068702.jpg,,vodka,2 cl,creme de banane,1 cl,orange juice,,,,,,,,,,,,,,,,,,,
