317,Chocolate Black Russian,"ordinary drink, shot",Combine all ingredients in an electric blender and blend at a low speed for a short length of time. Pour into a chilled champagne flute and serve.,http://www.thecocktaildb.com/images/media/drink/yyvywx1472720879.jpg,cream,kahlua,1 oz,vodka,1/2 oz,chocolate ice-cream,5 oz,,,,,,,,,,,,,,,,,,
318,Chocolate Drink,cocoa,"Melt the bar in a small amount of boiling water. Add milk. Cook over low heat, whipping gently (with a whisk, i would assume) until heated well. Don't let it boil! Serve in coffee mug.",http://www.thecocktaildb.com/images/media/drink/q7w4xu1487603180.jpg,,chocolate,125 gr,milk,3/4 l,water, ,,,,,,,,,,,,,,,,,,
319,Chocolate Milk,"shot, milk , float , shake","Put the milk in the bottom, pour the Liquer on top and add the dash of amaretto. Do not mix. SLAM IT!",http://www.thecocktaildb.com/images/media/drink/j6q35t1504889399.jpg,cream,chocolate liqueur,1/2 shot,milk,1/2 shot,amaretto,1 dash,,,,,,,,,,,,,,,,,,
320,Chocolate Monkey,"milk , float , shake, soft drink , soda","blend liqeuors with ice-cream, milk and syrup. pour into parfait glass, top with whipped cream and garnish with banana and cherry.",http://www.thecocktaildb.com/images/media/drink/tyvpxt1468875212.jpg,,banana liqueur,1 shot,creme de cacao,2 shots,chocolate ice-cream,2 scoops,chocolate syrup,1 oz,chocolate milk,4 oz,whipped cream,1,cherry,1,banana,1 piece,,,,,,,,
321,Chrysanthemum,,Combine ingredients together and serve,,unknown,dry vermouth,6 cl,benedictine,3 cl,absinthe,0.75 cl,,,,,,,,,,,,,,,,,,
322,Château Montifaud Creation,,"Pour the Cognac and lemon juice into the glass and then add orgeat syrup; fill with ices cubes and mix with a spoon. At the end, add lemonade and lemon peel.",,,chateau de montifaud cognac vs,1.5 oz,lemon juice,1 oz,orgeat (almond) syrup,.25 oz,triple sec,.25 oz,lemonade,top,,,,,,,,,,,,,,
323,Château Montifaud Lady Touch Triple Sec,,Pour the ingredients in the shaker. Close and shake well until frosted. Strain into the glass. Garnish with fresh mint.,,,chateau de montifaud reserve speciale michel vallet,1.5 oz,triple sec,.75 oz,lemon juice,1 oz,sugar syrup,1 oz,fresh mint,8,cubes,ic,,,,,,,,,,,,
324,Château Montifaud on Mint,,"Pour the sugar syrup into the glass and add fresh mint and green lemon. Lightly crush and add ice cubes, Cognac, lemon juice and sparkling water. Mix with a spoon and serve with a straw.",,,sugar syrup,1 coffee spoon,fresh mint,10,d green lemon,.25  slic,chateau de montifaud cognac vsop,1 oz,lemon juice,.75 oz,sparkling water,.75 oz,,,,,,,,,,,,
325,Château Montifaud on the Rocks,,Pour the Cognac into the glass and add ice cubes. Perceive the aromas that are released as a summer rain that reveals the secrets of the nature...,,,chateau de montifaud cognac xo,1.5 oz,cubes,3  ic,,,,,,,,,,,,,,,,,,,,
326,Château Montifaud Pink Love,,"Pour the Cognac, sugar syrup, lemon juice and 3 pressed raspberries into the shaker, then shake. Strain into the glass (using a cocktail strainer) and fill with chilled Champagne. Garnish with 3 raspberries.",,,chateau de montifaud xo silver,.75 oz,sugar syrup,.75 oz,lemon juice,.75 oz,raspberries,3,champagne,fill,,,,,,,,,,,,,,
327,Citrus Agave Caipirinha,,"Add soda to bucket first, then add spirits and mixers. Top with ice and garnish.",,,ypioca brasilizar cachaca prata classica,1.5 oz,citrus agave blend,1.5 oz,soda water,1 splash,,,,,,,,,,,,,,,,,,
328,Citrus Coke,"soft drink , soda, ordinary drink",Pour half of coke in a glass. Then add Bacardi and top it off with the remaining coke. Stir and drink up!,http://www.thecocktaildb.com/images/media/drink/uyrvut1479473214.jpg,sour,bacardi limon,1 part,coca-cola,2 parts,,,,,,,,,,,,,,,,,,,,
329,Citrus Quo (Adapted),,"Fill up a stem-less wine glass with ice and pour the ingredients over, stir and serve.",,,no.3 london dry gin,1.5 oz,luxardo limoncello,.5 oz,luxardo aperitivo,.5 oz,tonic water,3 oz,,,,,,,,,,,,,,,,
330,City Slicker,"ordinary drink, ordinary drink","In a shaker half-filled with ice cubes, combine all of the ingredients. Shake well. Strain into a cocktail glass.",http://www.thecocktaildb.com/images/media/drink/dazdlg1504366949.jpg,water,brandy,2 oz,triple sec,1/2 oz,lemon juice,1 tblsp,,,,,,,,,,,,,,,,,,
331,Classic Lolita,,Muddle Okinawa sugar with bitters. Add whisky and stir. Top with soda.,,,nikka whisky taketsuru,2 oz,okinawa sugar,.5 oz,soda,.5 oz,orange bitters,2 dash,old fashioned bitters,2 dash,,,,,,,,,,,,,,
332,Classic Old-Fashioned,"ordinary drink, ordinary drink","In an old-fashioned glass, muddle the bitters and water into the sugar cube, using the back of a teaspoon. Almost fill the glass with ice cubes and add the bourbon. Garnish with the orange slice and the cherry. Serve with a swizzle stick.",http://www.thecocktaildb.com/images/media/drink/anhof61504366173.jpg,,bitters,3 dashes,water,1 tsp,sugar,1,bourbon,3 oz,orange,1,maraschino cherry,1,,,,,,,,,,,,
333,Clear Intentions,,Stir all ingredients over cubed ice and then strain over large rock while incorporating the cream soda. Garnish with Italian baking spice infused olive and cherry.,,,luxardo bitter bianco,1.5 oz,krogstad aquavit,.5 oz,luxardo apricot liqueur,1 bsp,orange cream citrate,1 dash,almond cream soda,1.25 oz,,,,,,,,,,,,,,
334,Clearly Bitter,,Build all ingredients in a mixing glass. Stir with ice and strain into coupe. Garnish with grapefruit peel.,,,luxardo bitter bianco,.75 oz,junipero gin,1 oz,dry vermouth,.75 oz,curacao,.5 oz,rhubarb bitters,2 dash,,,,,,,,,,,,,,
335,Clove Cocktail,"ordinary drink, ordinary drink","Stir all ingredients with ice, strain into a cocktail glass, and serve.",http://www.thecocktaildb.com/images/media/drink/qxvtst1461867579.jpg,sweet,sweet vermouth,1 oz,sloe gin,1/2 oz,wine,1/2 oz muscatel,,,,,,,,,,,,,,,,,,
336,Clover Club,"ordinary drink, cocktail","Dry shake ingredients to emulsify, add ice, shake and served straight up.",http://www.thecocktaildb.com/images/media/drink/t0aja61504348715.jpg,sour,gin,1 1/2 oz,grenadine,2 tsp,lemon,juice of 1/2,egg white,1,,,,,,,,,,,,,,,,
337,Clover Holiday Cocktail,,"Mix all together and shake and double strain into a coupe without ice.. . *Bay Leaf-Infused Honey Syrup:. • 3 cups honey to 1 cup water. • 4 bay leaves, crumbled. <em>Bring to a boil. Stir until honey completely dissolves in water. Turn off heat and allow 2 hours to cool.</em>",,,hophead vodka,2 oz,lime juice,.75 oz,bay leaf-infused honey syrup*,.5 oz,clover's gingersnap,2 oz,cinnamon,1 pinc,,,,,,,,,,,,,,
338,Club Med,,"Fill up a wine glass with ice then pour the ingredients, stir and serve.",,,luxardo apricot liqueur,.75 oz,barsol selecto italia pisco,.75 oz,elderflower liqueur,.75 oz,white dry white(preferably sauvignon),2 oz,club soda,2 oz,,,,,,,,,,,,,,
339,Cocao Martini,,"Muddle 3 cacao beans in a mixing glass, add vodka, ginger-brown sugar, and Bitter Beast Hella Hula bitters. Add ice and vigorously shake to incorporate cacao flavor. Fine strain into a martini glass. Garnish with a cocao bean.",,,karlsson's gold vodka,2.5 oz,ginger brown*,.5 oz,hella hula bitters,4 dash,o beans,3 beans coc,,,,,,,,,,,,,,,,
340,Cock-tail,,"Shake all ingredients and strain into a coupe glass. Express a lemon peel over the drink and discard.. . *Rich Brown Sugar Simple Syrup: . -- 2 cups Brown Sugar. -- 1 cup Water. . Combine sugar and water in a small saucepan over medium heat and stir until sugar dissolves. Remove from heat, let cool to room temperature and transfer to a clean glass jar. Cover and keep refrigerated for up to 2 weeks.",,,junipero gin,1.5 oz,tempus fugit alessio vermouth di torino rosso,.75 oz,drambuie,.25 oz,rich brown sugar simple syrup*,.25 oz,s candied ginger,4  large piec,angostura bitters,3 dash,,,,,,,,,,,,
341,Coco Batida,,"Put 1 1/2 ounces of coconut milk, 1 1/2 ounces of condensed milk, 3 ounces of Ypiòca and tablespoon of sugar in a blender. Mix for a few seconds. Add ice cubes and serve.",,,coconut milk,1 1/2 oz,condensed milk,1 1/2 oz,ypiòca,3 oz,sugar,1 tbsp,,,,,,,,,,,,,,,,
342,Coffee & Clove,,Stir. Strain into Nick & Nora glass. Mist of Pipe Tobacco Tincture.,,,nikka coffey grain whisky,1.5 oz,manzanilla sherry,.75 oz,orange liqueur,.75 oz,clove tincture,2 dash,,,,,,,,,,,,,,,,
343,Coffee Liqueur,homemade liqueur,"Combine coffee, sugar and water. Simmer 1 hour and let cool. Add vanilla and vodka. Age in sealed jar 2 to 3 weeks.",http://www.thecocktaildb.com/images/media/drink/ryvtsu1441253851.jpg,,coffee,10 tblsp instant,vanilla extract,4 tblsp,sugar,2 1/2 cups,vodka,1 qt,water,2 1/2 cups,,,,,,,,,,,,,,
344,Coffee-Vodka,homemade liqueur,"Boil water and sugar until dissolved. Turn off heat. Slowly add dry instant coffee and continue stirring. Add a chopped vanilla bean to the vodka, then combine the cooled sugar syrup and coffee solution with the vodka. Cover tightly and shake vigorously each day for 3 weeks. Strain and filter. Its also best to let the sugar mixture cool completely so the vodka won't evaporate when its added. If you like a smoother feel to the liqueur you can add about 1 teaspoon of glycerine to the finished product.",http://www.thecocktaildb.com/images/media/drink/qvrrvu1472667494.jpg,,water,2 cups,sugar,2 cups white,coffee,1/2 cup instant,vanilla,2-jan,vodka,1 1/2 cup,caramel coloring,,,,,,,,,,,,,
345,Coffey Grain Manhattan,,Combine ingredients in a mixing glass with ice and stir. Strain into a coupe glass and garnish with a flamed orange peel.,,,nikka coffey grain whisky,2 oz,tempus fugit alessio vermouth di torino rosso,1 oz,tempus fugit abbott's bitters,1 dash,,,,,,,,,,,,,,,,,,
346,Coke and Drops,"soft drink , soda","Take a glass, pour the Coke in the glass, then you take 7 drops of lemon juice. Granish with a lemon slice on the rim of the glass.",http://www.thecocktaildb.com/images/media/drink/yrtxxp1472719367.jpg,,coca-cola,1 dl,lemon juice,7 drops,,,,,,,,,,,,,,,,,,,,
347,Conference,,"Stir all the ingredients over ice, then strain into a double rocks glass over 1 large ice cube. Garnish with a lemon twist and orange twist.. ",,,h by hine,.5 oz,rye whiskey,.5 oz,bourbon,.5 oz,calvados,.5 oz,demerara syrup,1 tsp,angostura bitters,2 dash,bittermens xocolatl mole bitters,1 dash,,,,,,,,,,
348,Coos Bay,,Stir and strain over ice.,,,nikka whisky taketsuru pure malt 12 yo,1.5 oz,etter zuger kirsch,.5 oz,doug fir riesling syrup*,.5 oz,kombu tincture**,15 dash,,,,,,,,,,,,,,,,
349,Corpse Reviver No 1,,Shake all the ingredients over ice and strain into a chilled coupe glass. Garnish with an orange twist.,,,h by hine,50 ml,calvados,25 ml,tempus fugit alessio vermouth bianco,25 ml,,,,,,,,,,,,,,,,,,
350,Corpse Reviver No.2,,Rinse cocktail glass with Vieux Pontarlier Absinthe. Shake rest with ice and strain.,,,no.3 london dry gin,.75 oz,tempus fugit kina l'aero d'or,.75 oz,the genuine curacao liqueur clear,.75 oz,lemon juice,.75 oz,ise superieure,rinse vieux pontarlier absinthe franc,,,,,,,,,,,,,,
351,Cosmopolitan,"cocktail, cocktail",Add all ingredients into cocktail shaker filled with ice. Shake well and double strain into large cocktail glass. Garnish with lime wheel.,http://www.thecocktaildb.com/images/media/drink/kpsajh1504368362.jpg,fresh,absolut citron,1 1/4 oz,lime juice,1/4 oz,cointreau,1/4 oz,cranberry juice,1/4 cup,,,,,,,,,,,,,,,,
352,Cosmopolitan Martini,"cocktail, cocktail","Pour all ingredients in mixing glass half filled with ice, shake and strain into chilled Martini glass.",http://www.thecocktaildb.com/images/media/drink/upxxpq1439907580.jpg,sweet,cointreau,1/2 oz,vodka,1 oz,lime,juice of 1/2,cranberry juice,1 splash,,,,,,,,,,,,,,,,
353,Cove,,,,,nikka whisky taketsuru pure malt 12 yo,1 oz,cynar,1 oz,mancino vermouth secco,1 oz,regans' orange bitters no. 6,1 tsp,,,,,,,,,,,,,,,,
354,Cranberry Cordial,homemade liqueur,"Place the chopped cranberries in a 2 liter jar that has a tight-fitting lid. Add the sugar and rum. Adjust the lid securely and place the jar in a cool, dark place. Invert the jar and shake it every day for six weeks. Strain the cordial into bottles and seal with corks.",http://www.thecocktaildb.com/images/media/drink/qtspsx1472667392.jpg,,cranberries,1/2 kg chopped,sugar,3/4 l,light rum,1/2 l,,,,,,,,,,,,,,,,,,
355,Cranberry Punch,"punch , party drink","Combine first four ingredients. Stir until sugar is dissolved, chill. Then add ginger ale just before serving. Add ice ring to keep punch cold.",http://www.thecocktaildb.com/images/media/drink/mzgaqu1504389248.jpg,,cranberry juice,4 cups,sugar,1 1/2 cup,pineapple juice,4 cups,almond flavoring,1 tblsp,ginger ale,2 qt,,,,,,,,,,,,,,
356,Cream of the Crop,,"Shake with ice in a mixing glass for about 15 seconds to properly chill. Double strain into a small fizz glass over ice.. . *Coconut Pistachio Puree:. -- .5 lb Pistachios (toasted). -- 1.5 lbs Sugar (144 oz.). -- 11 oz Coconut Milk. -- 13 oz Water. -- 1 tsp Salt. . Toast the pistachios at 250°F for 20 mins. Remove and put in a blender with sugar until well chopped. Combine all the ingredients in a pot and bring to a boil. Let simmer for 20 mins and then remove from the heat. Let cool and place in a large container. Let the mixture sit overnight then strain out the solids. Save the solids to spin in the ice cream maker (if you have one). Spin the solids and add the mixture back into the puree via chinois. Bottle, label and date the syrup (it will keep indefinitely if you freeze it).",,,mezcal,1 oz,king's ginger liqueur,1 oz,coconut pistachio puree*,.75 oz,lemon juice,.75 oz,,,,,,,,,,,,,,,,
357,Cream Soda,"cocktail, ordinary drink",Pour 1oz of Spiced Rum into a highball glass with ice. Fill with Ginger Ale.,http://www.thecocktaildb.com/images/media/drink/yqstxr1479209367.jpg,,spiced rum,1 oz,ginger ale,,,,,,,,,,,,,,,,,,,,,
358,Creek Ran Dry,,Barrel aged for 5 months in a used bourbon barrel.. . Stir with ice and strain into a small coupe. Garnish with an orange twist.,,,pear brandy,1 oz,dry vermouth,1 oz,chateau de montifaud pineau des charentes blanc,.5 oz,dolin genepy,.5 oz,,,,,,,,,,,,,,,,
359,Creme de Menthe,homemade liqueur,Bring sugar and water to a boil and simmer for 10 minutes. Cool. Add the remaining ingredients and stir. Cover and let ripen for 1 month.,http://www.thecocktaildb.com/images/media/drink/yxswtp1441253918.jpg,,sugar,8 cups,water,6 cups,grain alcohol,1 pint,peppermint extract,1 oz pure,food coloring,1 tblsp green,,,,,,,,,,,,,,
360,Creole,,Stir. Strain into martini glass. Garnish with lemon twist.,,,h by hine,1.5 oz,clement creole shrubb,.75 oz,fino sherry,.75 oz,orange bitters,2 dash,,,,,,,,,,,,,,,,
361,Creole Cobbler,,"Shake all ingredients in an ice-filled cocktail shaker. Strain, and Serve.",,,junipero gin,1 oz,sathenay crème de peche,1 1/2 oz,fresh lemon juice,1/2 oz,2 dashes orange bitters,oz,,,,,,,,,,,,,,,,
362,Creole Summer,,Shake all ingredients with ice. Strain into a chilled cocktail glass.,,,vanilla flavored vodka,1.5 oz,luxardo limoncello,.75 oz,fresh sweet n' sour,1 oz,passion fruit puree,.5 oz,egg white,.5 oz,green tabasco,7 dash,,,,,,,,,,,,
363,Croatia Firing Squad,,"Build cocktail in glass, add ice and stir. Garnish with rose petal.",,,luxardo bitter bianco,1 oz,lillet blanc,1 oz,no.3 london dry gin,1 oz,rose wine,.5 oz,,,,,,,,,,,,,,,,
364,Crooked Kilt,,Pour over crushed ice with a mint garnish.,,,glenrothes vintage reserve,1.5 oz,lime juice,.75 oz,green chartreuse,.5 oz,velvet falernum,.5 oz,pineapple juice,.5 oz,,,,,,,,,,,,,,
365,Cuba Liberation,,Add first three ingredients to a mixing glass with shaker and lightly shake with ice. Pour mixture into a Collins or highball glass over ice. Top with Mexican Coke (or any coca cola as a substitute) and pour Luxardo Fernet on top to float. Garnish with a lime wheel and fresh mint sprig.,,,pink pigeon rum,2 oz,fresh lime juice,1.5 oz,simple syrup,.25 oz,mexican coca cola,oz,luxardo fernet,1 float,,,,,,,,,,,,,,
366,Cuba Libra,"ordinary drink, ordinary drink",Fill tall glass with ice cubes. Add rum. Rub cut edge of lime on rim of glass then squeeze juice into glass. Fill with Coca-Cola. Garnish with lime slice. Enjoy!,http://www.thecocktaildb.com/images/media/drink/ck6d0p1504388696.jpg,,dark rum,1-2 shot,lime,squeeze,coca-cola,fill with,ice,,,,,,,,,,,,,,,,,
367,Cuba Libre,"ordinary drink, ordinary drink",Build all ingredients in a Collins glass filled with ice. Garnish with lime wedge.,http://www.thecocktaildb.com/images/media/drink/uuxsrr1473201663.jpg,sour,light rum,2 oz,lime,juice of 1/2,coca-cola, ,,,,,,,,,,,,,,,,,,
368,Culebra,,"Place the mint in a Collins glass and muddle for a few seconds to release the oils, then add ice and ingredients, stir well and serve.",,,rhum agricole-style,1.5 oz,luxardo amaretto di saschira,.75 oz,fresh lime juice,.5 oz,cola,4 oz,mint sprigs,3 oz,bitters,2 dash,,,,,,,,,,,,
369,Cullerton Street,,"Stir. Add ice cube.. . *Barley Tea-Infused Nikka Coffey Grain Whiskey:. -- 10 g. Barley Tea (1 package). -- 750 mls. Nikka Coffey Grain Whisky. In a cambro, empty a bottle of Nikka Coffey Grain Whiskey, add 1 package of barley tea.. Steep for 30 minutes at room temperature.. Strain and store.",,,barley tea-infused nikka coffey grain whisky*,2 oz,verjus blanc,.25 oz,kummel liqueur,.25 oz,pineau des charentes,.75 oz,demerara sugar syrup,1 tsp,,,,,,,,,,,,,,
370,Cupid's Carrier Pigeon,,"Shake, strain into a Tiki glass over crushed ice and garnish with a large sprig of mint.. . ",,,no.3 london dry gin,1 oz,velvet falernum,1 oz,pink pigeon rum,.75 oz,unfiltered apple juice,1 oz,lime juice,1 oz,angostura bitters,3 dash,,,,,,,,,,,,
371,Cut & Rum,,"Add all ingredients in mixing glass, stir and strain over 2x2 ice cube in smoked glass on hickory board. Garnish with orange peel and clothes pin.",,,banks 5 rum,.75 oz,denizen aged white rum,.75 oz,denizen aged white rum,.75 oz,luxardo amaro abano,.75 oz,,,,,,,,,,,,,,,,
372,Cut and Run,,"Combine all the ingredients in a mixing glass and stir for about 10 seconds. Strain in to an Old Fashioned glass or glass of your choosing. Add large ice cubes. Garnish with a lemon wheel, mint sprigs and a blackberry.. . *Moroccan Mint Tea (Numi Tea Brand):. -- 1 Moroccan Mint Tea Bag. -- 8 oz. Boiling Water.  . Combine the tea bag and the boiling water in a cup or a pot. Let steep for 5 minutes. Remove the tea bag and place the tea in the fridge to cool. Label and date the container. Will keep for 1 week.. . **Rich Honey Syrup:. -- 10 oz. Honey. -- 5 oz. Hot Water. . Combine both ingredients together in a container and stir until fully incorporated. Label and date the container. Will keep in the fridge for 2 weeks.",,,j.h. cutter whisky,1.5 oz,moroccan mint tea (chilled)*,1 oz,the king's ginger,.75 oz,lemon juice,.5 oz,rich honey syrup**,.25 oz,,,,,,,,,,,,,,
373,Cut To The Chase,,Combine all ingredients in to a mixing glass and add ice.. . Stir for about 10-15 seconds.. . Strain in to a cocktail coupe or a glass of your choosing.. . Garnish with an orange twist expressed over the top of the drink.,,,j.h. cutter whisky,2 oz,averna amaro,.75 oz,alvear px sherry,.5 oz,angostura bitters,2 dash,,,,,,,,,,,,,,,,
374,Cynar Toronto,,Combine ingredients together and serve,,bitter sweet,rye whiskey,6 cl,cynar,2 cl,angostura bitters,4 dashes,,,,,,,,,,,,,,,,,,
375,Cynartown,,Combine ingredients together and serve,,bitter sweet,gin,6 cl,sweet vermouth,2.25 cl,cynar,1.5 cl,,,,,,,,,,,,,,,,,,
376,Daiquiri,"ordinary drink, shot",Pour all ingredients into shaker with ice cubes. Shake well. Strain in chilled cocktail glass.,http://www.thecocktaildb.com/images/media/drink/usuuur1439906797.jpg,fresh,light rum,1 1/2 oz,lime,juice of 1/2,powdered sugar,1 tsp,,,,,,,,,,,,,,,,,,
377,Daisy Mae,,Shake and strain into a rocks glass. Garnish with a mint sprig.,,,junipero gin,2 oz,lime juice,1 oz,green chartreuse,.75 oz,simple syrup,.75 oz,,,,,,,,,,,,,,,,
378,Damned if you do,"shot, coffee , tea",Pour into shot glass. Put in mouth. Repeat as deemed necessary.,http://www.thecocktaildb.com/images/media/drink/ql7bmx1503565106.jpg,,whiskey,0.75 oz,hot damn,0.25 oz,,,,,,,,,,,,,,,,,,,,
379,Danbooka,"coffee , tea, cocktail",pour it in and mix it.,http://www.thecocktaildb.com/images/media/drink/vurrxr1441246074.jpg,,coffee,3 parts,everclear,1 part,,,,,,,,,,,,,,,,,,,,
380,Dark and Stormy,"ordinary drink, soft drink , soda",In a highball glass filled with ice add 6cl dark rum and top with ginger beer. Garnish with lime wedge.,http://www.thecocktaildb.com/images/media/drink/t1tn0s1504374905.jpg,sweet,dark rum,5 cl,ginger beer,10 cl,,,,,,,,,,,,,,,,,,,,
381,Dark Caipirinha,"cocktail, ordinary drink","Muddle the sugar into the lime wedges in an old-fashioned glass.
Fill the glass with ice cubes.
Pour the cachaca into the glass.
Stir well.",http://www.thecocktaildb.com/images/media/drink/uwstrx1472406058.jpg,,demerara sugar,2 tsp,lime,1,cachaca,2 1/2 oz,,,,,,,,,,,,,,,,,,
382,Darkwood Sling,"soft drink , soda, ordinary drink","There are many good cherry liqueurs you can use, but I prefere Heering. Add one share of the liqueur. Then you add one share of Soda. For a sour sling use Tonic (most people prefer the drink without Tonic). Afterwards you fill the glass with Orange Juice and ice cubes.",http://www.thecocktaildb.com/images/media/drink/sxxsyq1472719303.jpg,mint,cherry heering,1 part,soda water,1 part,orange juice,1 part,ice,cubes,,,,,,,,,,,,,,,,
383,Day For Night,,Stir and strain into a chilled Nick and Nora glass. Garnish with a clove(2) studded orange coin.,,,c. drouin calvados selection,1.5 oz,la quintinye vermouth rouge,.5 oz,pedro ximenez sherry,.25 oz,cannella cinnamon cordial,.25 oz,angostura bitters,1 dash,,,,,,,,,,,,,,
384,Delicious in Mauritius,,"Shake all ingredients except ginger ale, then strain into chilled cocktail ""coupe"" glass. Float ginger ale and zest of fresh lemon.",,,pink pigeon rum,1.5 oz,white peach puree,.5 oz,hibiscus syrup,.25 oz,lemon juice,.25 oz,ginger ale,.5 oz,,,,,,,,,,,,,,
385,Delicious Sour,,"Dry shake. Add ice, shake. Double strain into a frozen coupe glass. Garnish with lemon twist or dehydrated apple slice.",,,c. drouin calvados selection,2 oz,lemon juice,.75 oz,giffard abricot du roussillon,.75 oz,egg white,.5 oz,,,,,,,,,,,,,,,,
386,Derby,"ordinary drink, beer",Pour all ingredients into a mixing glass with ice. Stir. Strain into a cocktail glass. Garnish with a sprig of fresh mint in the drink.,http://www.thecocktaildb.com/images/media/drink/i502ra1504349156.jpg,,gin,6 cl,peach bitters,2 dashes,mint,2 fresh leaves,,,,,,,,,,,,,,,,,,
387,Derby cocktail,,Combine ingredients together and serve,,boozy,bourbon whiskey,6 cl,benedictine,0.75 cl,angustura,1 dash,,,,,,,,,,,,,,,,,,
388,Dernier Mot,,Shake until very cold; double strain into a chilled cocktail glass. No garnish.,,,rhum agricole,.75 oz,green chartreuse,.75 oz,luxardo maraschino liqueur,.75 oz,fresh lime juice,.75 oz,,,,,,,,,,,,,,,,
389,Desmond's Choice,,"In old fashioned glass, lightly muddle orange zest with bitters and orange curacao.  Add bourbon and creme de cacao then stir with ice for proper dilution (depending on ice) and mixing of ingredients.",,,hirsch small batch reserve bourbon,2 oz,creme de cacao,.5 oz,pierre ferrand dry orange curacao,.25 oz,the bitter truth jerry thomas bitters,3 dash,,,,,,,,,,,,,,,,
390,Deviled Negroni,,"Stir all 3 ingredients continuously in an ice-filled glass, approximately 20 seconds. Strain into a rocks glass with one large ice cube.",,,no.3 london dry gin,1 oz,maurin quina,1 oz,luxardo bitter,1 oz,,,,,,,,,,,,,,,,,,
391,Diesel,"beer, cocktail",Pour the lager first then add the blackcurrant cordial. Top up with the cider. The colour sholud be very dark approaching the colour of Guiness.,http://www.thecocktaildb.com/images/media/drink/sxrrqq1454512852.jpg,sour,lager,1/2 pint,cider,1/2 pint,blackcurrant cordial,1 dash,,,,,,,,,,,,,,,,,,
392,Dirt Nap,,Stir with ice and serve in a Nick and Nora glass (slimmer version of a coupe).,,,noilly prat dry vermouth*,1.5 oz,oloroso sherry,.75 oz,king's ginger liqueur,.75 oz,,,,,,,,,,,,,,,,,,
393,Dirty Martini,"cocktail, shot","Pour the vodka, dry vermouth and olive brine into a cocktail shaker with a handful of ice and shake well.
Rub the rim of a martini glass with the wedge of lemon.
Strain the contents of the cocktail shaker into the glass and add the olive.
A dirty Martini contains a splash of olive brine or olive juice and is typically garnished with an olive.",http://www.thecocktaildb.com/images/media/drink/vcyvpq1485083300.jpg,,vodka,70ml/2fl oz,dry vermouth,1 tbsp,olive brine,2 tbsp,lemon,1 wedge,olive,1,,,,,,,,,,,,,,
394,Dirty Nipple,"shot, punch , party drink",This is a layered shot - the Bailey's must be on top,http://www.thecocktaildb.com/images/media/drink/vtyqrt1461866508.jpg,,kahlua,,sambuca,,bailey's irish cream,,,,,,,,,,,,,,,,,,,
395,Divine Aspect,,Stir and strain up into cocktail glass.,,,no.3 london dry gin,1 oz,apple-infused wild turkey bourbon 101,1 oz,luxardo apricot liqueur,1 oz,,,,,,,,,,,,,,,,,,
396,Division Bell,,Fill a cocktail shaker with ice. Add ingredients and shake well. Strain into a chilled coupe or martini glass and garnish with the grapefruit twist.,,,mezcal,1 oz,aperol,.75 oz,luxardo maraschino liqueur,.5 oz,lime juice,.75 oz,,,,,,,,,,,,,,,,
397,Doctor's Orders,,Stir. Serve in a small cocktail glass. Lemon twist to garnish.,,,junipero gin,1.75 oz,dry vermouth,.75 oz,curacao,.25 oz,tempus fugit abbott's bitters,1 dash,,,,,,,,,,,,,,,,
398,Doitashimashie,,,,,nikka coffey grain whisky,2 oz,demerara syrup,.25 oz,angostura bitters,1 dash,,,,,,,,,,,,,,,,,,
399,Don't Rock the Boat Punch,,"Combine ingredients into a chilled punch bowl, ice and dilute appropriately, garnish seasonally.",,,part no.3 london dry gin,1,oled),1 part rooibus tea (steeped and c,oled),1 part mulled cider (c,part clover honey syrup,.5,part cava,.33,angostura,angostur,,,,,,,,,,,,
